{
  "schema_version": "1.0.0",
  "feature_package_id": "feature-package/feat-publish-pipeline",
  "parent_feature": "feat-publish-pipeline",
  "repo_context": {
    "config_path": ".dev-graph/config.json",
    "repo_identity": "github:daishiman/HarnessHub",
    "root_resolution_source": "explicit-cli"
  },
  "source_lineage": {
    "source_plugin": "system-spec-harness",
    "source_version": "0.1.0",
    "compile_entrypoint": "run-system-spec-compile",
    "completeness_entrypoint": "assign-system-spec-completeness-evaluator",
    "source_paths": [
      "system-spec/00-requirements-definition.md",
      "system-spec/spec-state.json",
      "docs/backend-spec.md",
      "architecture/harness-hub-backend.md",
      "architecture/harness-hub-data.md",
      "architecture/harness-hub-security.md",
      "features/feat-publish-pipeline.md",
      "features/feat-publish-pipeline.context.json",
      "goal-spec.json",
      "specs/harness-hub-system-specification.md"
    ],
    "confirmed": true
  },
  "tasks": [
    {
      "id": "SYS-PUBLISH-PIPELINE-P01",
      "feature_package_id": "feature-package/feat-publish-pipeline",
      "parent_feature": "feat-publish-pipeline",
      "title": "PublishRequest 状態機械・検査 pipeline・promote/rollback 要件ベースライン確定",
      "owners": [
        "daishiman"
      ],
      "tags": [
        "feat-publish-pipeline",
        "macro-feature",
        "backend",
        "requirements-baseline"
      ],
      "related_nodes": [
        "feat-publish-pipeline",
        "arch-harness-hub-backend",
        "arch-harness-hub-data",
        "arch-harness-hub-security"
      ],
      "workstream_kind": "documentation",
      "secondary_workstreams": [
        "security",
        "quality"
      ],
      "build_target_kind": "application-code",
      "phase_ref": "P01",
      "depends_on": [],
      "write_scope": [
        "docs/features/feat-publish-pipeline/requirements-baseline.md"
      ],
      "deploy_unit": "cloudflare-workers/hub",
      "source_lineage": [
        "system-spec/00-requirements-definition.md",
        "system-spec/spec-state.json",
        "docs/backend-spec.md",
        "features/feat-publish-pipeline.md",
        "features/feat-publish-pipeline.context.json",
        "goal-spec.json",
        "architecture/harness-hub-backend.md",
        "architecture/harness-hub-data.md",
        "architecture/harness-hub-security.md",
        "specs/harness-hub-system-specification.md"
      ],
      "classification": {
        "confidence": 0.91,
        "reason": "goal-spec (goal-spec.json) と features/feat-publish-pipeline.md の purpose/goal/scope/acceptance/quality_constraints を要件ベースラインへ確定転記する P01 タスク",
        "candidates": [
          {
            "artifact_kind": "task",
            "confidence": 0.91,
            "candidate_path": "tasks/feat-publish-pipeline/sys-publish-pipeline-p01.md"
          }
        ]
      },
      "tracker_binding_intent": "beads",
      "github_publication": {
        "mode": "local_only",
        "project_aliases": [],
        "labels": [],
        "milestone": null
      },
      "pr_completion_policy": "linked_pr_merged_all",
      "branch_policy": {
        "strategy": "one-task-one-branch",
        "worktree_lease_required": true,
        "completion_projection": "default-branch-reconciliation",
        "assignment_owner": "dev-graph-scheduler"
      },
      "acceptance": [
        "docs/features/feat-publish-pipeline/requirements-baseline.md に goal-spec acceptance 3 件と quality_constraints 8 件が過不足なく転記されている",
        "現行feature context sha256:7a4625914be99dd47f51c4c92698737ad8fe431319995457a6cadc5fd39d2f41のscope_in/acceptance全件をP01責務として追跡し、未割当0件である",
        "Normative closure: endpoint別認証を固定する。POST /publish・PUT /publish/:id/package・POST /publish/:id/submit はsession(Web)+Bearer(CLI)のdual principal、session state-changing経路はOrigin/CSRF必須、BearerはCSRF非該当。GET list/idもdual。approveはsession/workspace-admin、cancelとprojects/:id/deploymentはBearer/owner。全経路が同一tenant/owner判定、zod contract、状態機械、Idempotency-Key/直列化を共有する。 Evidence: session/Bearer parity、session CSRF欠落403、Bearerでcookie/CSRF非依存、cross-tenant拒否、role matrix、状態遷移/property test、P12 runbookとP13 smokeを必須とする。"
      ],
      "verification": [
        "python3 plugins/system-dev-planner/scripts/validate-system-plan.py --repo-root . --staging ."
      ],
      "rollback": "goal-spec と features/feat-publish-pipeline.md の内容不一致が判明した場合、requirements-baseline.md を作成前状態 (ファイル未作成) に戻し、goal-spec 側の再確定を dev-graph へ差し戻す",
      "implementation_readiness": {
        "status": "complete",
        "missing_sections": [],
        "checked_at": "2026-07-19T13:26:55Z"
      },
      "graph_node_registration": {
        "graph_node_id": "SYS-PUBLISH-PIPELINE-P01",
        "file_path": "tasks/feat-publish-pipeline/sys-publish-pipeline-p01.md",
        "parent_feature": "feat-publish-pipeline",
        "feature_package_id": "feature-package/feat-publish-pipeline",
        "phase_ref": "P01"
      }
    },
    {
      "id": "SYS-PUBLISH-PIPELINE-P02",
      "feature_package_id": "feature-package/feat-publish-pipeline",
      "parent_feature": "feat-publish-pipeline",
      "title": "アーキテクチャ設計 — PublishRequest 状態機械実装方式・検査 pipeline 共有パッケージ・R2/監査/認可 consumer 境界確定",
      "owners": [
        "daishiman"
      ],
      "tags": [
        "feat-publish-pipeline",
        "macro-feature",
        "backend",
        "architecture-decision"
      ],
      "related_nodes": [
        "feat-publish-pipeline",
        "arch-harness-hub-backend",
        "arch-harness-hub-data",
        "arch-harness-hub-security"
      ],
      "workstream_kind": "backend",
      "secondary_workstreams": [
        "security",
        "data",
        "api"
      ],
      "build_target_kind": "application-code",
      "phase_ref": "P02",
      "depends_on": [
        "SYS-PUBLISH-PIPELINE-P01"
      ],
      "write_scope": [
        "docs/features/feat-publish-pipeline/architecture-decision-record.md"
      ],
      "deploy_unit": "cloudflare-workers/hub",
      "source_lineage": [
        "docs/backend-spec.md",
        "architecture/harness-hub-backend.md",
        "architecture/harness-hub-data.md",
        "architecture/harness-hub-security.md",
        "goal-spec.json",
        ".dev-graph/plans/feature-package-feat-domain-model-db/task-specs/phase-02-architecture.md",
        ".dev-graph/plans/feature-package-feat-auth-tenancy/task-specs/phase-05-implementation.md",
        "features/feat-publish-pipeline.context.json",
        "specs/harness-hub-system-specification.md"
      ],
      "classification": {
        "confidence": 0.9,
        "reason": "PublishRequest 状態機械の実装方式・検査 pipeline 共有パッケージ設計・REST endpoint 設計に加え、publish_requests 等のスキーマ owner (feat-domain-model-db) と単一認可ミドルウェア owner (feat-auth-tenancy) の cross-feature 境界確定を行う P02 architecture decision タスク",
        "candidates": [
          {
            "artifact_kind": "task",
            "confidence": 0.9,
            "candidate_path": "tasks/feat-publish-pipeline/sys-publish-pipeline-p02.md"
          }
        ]
      },
      "tracker_binding_intent": "beads",
      "github_publication": {
        "mode": "local_only",
        "project_aliases": [],
        "labels": [],
        "milestone": null
      },
      "pr_completion_policy": "linked_pr_merged_all",
      "branch_policy": {
        "strategy": "one-task-one-branch",
        "worktree_lease_required": true,
        "completion_projection": "default-branch-reconciliation",
        "assignment_owner": "dev-graph-scheduler"
      },
      "acceptance": [
        "architecture-decision-record.md に publish_requests 等のスキーマ owner 確定・単一認可ミドルウェア owner 確定・検査 pipeline owner/消費境界確定の 3 系統 architecture decision と、状態機械実装方式・REST API 12 経路設計・TargetChannel 直列化実装方式が記載されている",
        "現行feature context sha256:7a4625914be99dd47f51c4c92698737ad8fe431319995457a6cadc5fd39d2f41のscope_in/acceptance全件をP02責務として追跡し、未割当0件である",
        "Normative closure: endpoint別認証を固定する。POST /publish・PUT /publish/:id/package・POST /publish/:id/submit はsession(Web)+Bearer(CLI)のdual principal、session state-changing経路はOrigin/CSRF必須、BearerはCSRF非該当。GET list/idもdual。approveはsession/workspace-admin、cancelとprojects/:id/deploymentはBearer/owner。全経路が同一tenant/owner判定、zod contract、状態機械、Idempotency-Key/直列化を共有する。 Evidence: session/Bearer parity、session CSRF欠落403、Bearerでcookie/CSRF非依存、cross-tenant拒否、role matrix、状態遷移/property test、P12 runbookとP13 smokeを必須とする。"
      ],
      "verification": [
        "python3 plugins/system-dev-planner/scripts/validate-system-plan.py --repo-root . --staging ."
      ],
      "rollback": "feat-domain-model-db または feat-auth-tenancy 側の write_scope・公開 API が今後変更され本 architecture decision の前提が崩れた場合、本 task の architecture decision を re-open し P02 を再実行する。再実行までは P03 以降の着手を保留する",
      "implementation_readiness": {
        "status": "complete",
        "missing_sections": [],
        "checked_at": "2026-07-19T13:26:55Z"
      },
      "graph_node_registration": {
        "graph_node_id": "SYS-PUBLISH-PIPELINE-P02",
        "file_path": "tasks/feat-publish-pipeline/sys-publish-pipeline-p02.md",
        "parent_feature": "feat-publish-pipeline",
        "feature_package_id": "feature-package/feat-publish-pipeline",
        "phase_ref": "P02"
      }
    },
    {
      "id": "SYS-PUBLISH-PIPELINE-P03",
      "feature_package_id": "feature-package/feat-publish-pipeline",
      "parent_feature": "feat-publish-pipeline",
      "title": "独立設計レビュー — スキーマ owner 境界・状態機械設計・検査 pipeline 設計の妥当性確認",
      "owners": [
        "daishiman"
      ],
      "tags": [
        "feat-publish-pipeline",
        "macro-feature",
        "quality",
        "design-review"
      ],
      "related_nodes": [
        "feat-publish-pipeline",
        "arch-harness-hub-backend",
        "arch-harness-hub-data",
        "arch-harness-hub-security"
      ],
      "workstream_kind": "quality",
      "secondary_workstreams": [
        "security",
        "documentation"
      ],